title,score,upvote_ratio,num_comments,author,subreddit,url,permalink,created_utc,is_self,selftext,flair,domain,search_query
"Nvidia just dropped a bombshell: Its new AI model is open, massive, and ready to rival GPT-4",1710.0,0.97,216.0,norcalnatv,Artificial,https://venturebeat.com/ai/nvidia-just-dropped-a-bombshell-its-new-ai-model-is-open-massive-and-ready-to-rival-gpt-4/,/r/artificial/comments/1fu93k4/nvidia_just_dropped_a_bombshell_its_new_ai_model/,1727847601.0,,,News,venturebeat.com,GPT-4
"GPT-5 arrives imminently. Here's what the hype won't tell you. | Curb your enthusiasm: OpenAI's latest model is said to be smarter than GPT-4, but not by much.",287.0,0.84,263.0,creaturefeature16,Artificial,https://mashable.com/article/gpt5-coming,/r/artificial/comments/1mjd08m/gpt5_arrives_imminently_heres_what_the_hype_wont/,1754505893.0,,">Altman's careful language tracks with a new and [devastating report](https://www.theinformation.com/articles/inside-openais-rocky-path-gpt-5) from Silicon Valley scoop machine The Information. According to multiple sources inside OpenAI and its partner Microsoft, the upgrades in GPT-5 are mostly in the areas of solving math problems and writing software code — and even they ""won’t be comparable to the leaps in performance of earlier GPT-branded models, such as the improvements between GPT-3 in ",News,mashable.com,GPT-4
Just so you know,2769.0,0.79,1093.0,vesperythings,Artificial,https://i.redd.it/w0n0t016otkf1.png,/r/artificial/comments/1myawzu/just_so_you_know/,1755978036.0,,,Discussion,i.redd.it,GPT-4
He predicted this 2 years ago.,3669.0,0.96,360.0,Sad_Cardiologist_835,Artificial,https://i.redd.it/3ctmwrgrqxhf1.jpeg,/r/artificial/comments/1mli9da/he_predicted_this_2_years_ago/,1754719765.0,,Have really hit a wall?,Discussion,i.redd.it,GPT-4
"OpenAI CTO says GPT-3 was toddler-level, GPT-4 was a smart high schooler and the next gen, to be released in a year and a half, will be PhD-level",132.0,0.75,121.0,Maxie445,Artificial,https://twitter.com/tsarnick/status/1803901130130497952,/r/artificial/comments/1dktc5w/openai_cto_says_gpt3_was_toddlerlevel_gpt4_was_a/,1718937150.0,,,News,twitter.com,GPT-4
GPT-4 shows emergent Theory of Mind on par with an adult. It scored in the 85+ percentile for a lot of major college exams. It can also do taxes and create functional websites from a simple drawing,258.0,0.9,164.0,lostlifon,Artificial,https://www.reddit.com/gallery/11rvzgg,/r/artificial/comments/11rvzgg/gpt4_shows_emergent_theory_of_mind_on_par_with_an/,1678885999.0,,,News,reddit.com,GPT-4
Tree of LifeGPT-4 reasoning Improved 900%.,254.0,0.95,134.0,Department_Wonderful,Artificial,https://www.reddit.com/r/artificial/comments/13n7zqn/tree_of_lifegpt4_reasoning_improved_900/,/r/artificial/comments/13n7zqn/tree_of_lifegpt4_reasoning_improved_900/,1684615256.0,True,"I just watched this video, and I wanted to share it with the group. I want to see what you think about this? Have a great night. 

https://youtu.be/BrjAt-wvEXI

Tree of Thoughts (ToT) is a new framework for language model inference that generalizes over the popular “Chain of Thought” approach to prompting language models¹. It enables exploration over coherent units of text (“thoughts”) that serve as intermediate steps toward problem solving¹. ToT allows language models to perform deliberate deci",AGI,self.artificial,GPT-4
GPT-4 now exceeds humans at theory of mind tasks,256.0,0.86,72.0,Maxie445,Artificial,https://i.redd.it/wx14uvidxo3d1.jpeg,/r/artificial/comments/1d4nb3n/gpt4_now_exceeds_humans_at_theory_of_mind_tasks/,1717130097.0,,https://arxiv.org/abs/2405.18870,News,i.redd.it,GPT-4
Another study showing GPT-4 outperforming human doctors at showing empathy,182.0,0.85,77.0,Maxie445,Artificial,https://jamanetwork.com/journals/jamanetworkopen/fullarticle/2821167,/r/artificial/comments/1e5a16e/another_study_showing_gpt4_outperforming_human/,1721193169.0,,,News,jamanetwork.com,GPT-4
GPT-4 given $100 and told to make as much money as possible,382.0,0.95,84.0,jaredigital62,Artificial,https://twitter.com/jacksonfall/status/1636107218859745286?s=42&t=TCif-8-RF6HpGcDmaOEB3g,/r/artificial/comments/11su1tj/gpt4_given_100_and_told_to_make_as_much_money_as/,1678972980.0,,,News,twitter.com,GPT-4
OpenAI Roadmap Update for GPT-4.5 & GPT-5,2307.0,0.95,320.0,73ch_nerd,OpenAI,https://i.redd.it/j6j5diamdrie1.jpeg,/r/OpenAI/comments/1inz75h/openai_roadmap_update_for_gpt45_gpt5/,1739388021.0,,,News,i.redd.it,GPT-4
GPT 4 to GPT 5 !! If you think it's just too big difference,749.0,0.9,261.0,Independent-Wind4462,OpenAI,https://i.redd.it/ewb21so66mjf1.png,/r/OpenAI/comments/1mswtl2/gpt_4_to_gpt_5_if_you_think_its_just_too_big/,1755451367.0,,,Discussion,i.redd.it,GPT-4
GPT-4.5 has an API price of $75/1M input and $150/1M output. ChatGPT Plus users are going to get 5 queries per month with this level of pricing.,926.0,0.97,293.0,queendumbria,OpenAI,https://i.redd.it/zjx8b508qqle1.png,/r/OpenAI/comments/1izpgct/gpt45_has_an_api_price_of_751m_input_and_1501m/,1740687714.0,,,Discussion,i.redd.it,GPT-4
"Confirmed by openAI employee, the rate limit of GPT 4.5 for plus users is 50 messages / week",909.0,0.92,215.0,Snoo26837,OpenAI,https://i.redd.it/cxkcinv9fyme1.jpeg,/r/OpenAI/comments/1j4h8b9/confirmed_by_openai_employee_the_rate_limit_of/,1741216719.0,,,News,i.redd.it,GPT-4
"OpenAI announced that GPT 4.5 is going soon, to free up GPUs!",948.0,0.97,139.0,TheSpaceFace,OpenAI,https://i.redd.it/npw34s7g4uue1.jpeg,/r/OpenAI/comments/1jz4igm/openai_announced_that_gpt_45_is_going_soon_to/,1744651461.0,,,Discussion,i.redd.it,GPT-4
Claude 3 Opus Becomes the New King! Haiku is GPT-4 Level which is Insane!,1355.0,0.97,228.0,lordpermaximum,OpenAI,https://i.redd.it/abeuuw3vgrqc1.png,/r/OpenAI/comments/1bomdsh/claude_3_opus_becomes_the_new_king_haiku_is_gpt4/,1711494846.0,,,News,i.redd.it,GPT-4
Make GPT-4 your b*tch!,1689.0,0.92,204.0,illusionst,OpenAI,https://www.reddit.com/r/OpenAI/comments/186gk3b/make_gpt4_your_btch/,/r/OpenAI/comments/186gk3b/make_gpt4_your_btch/,1701231166.0,True,"The other day, I’m 'in the zone' writing code, upgrading our OpenAI python library from  0.28.1 to 1.3.5, when this marketing intern pops up beside my desk. 

He’s all flustered, like, 'How do I get GPT-4 to do what I want? It’s repeating words, the answers are way too long, and it just doesn’t do that thing I need.'

So, I dive in, trying to break down frequency penalty, logit bias, temperature, top_p – all that jazz. But man, the more I talk, the more his eyes glaze over. I felt bad (No bad st",Discussion,self.OpenAI,GPT-4
Goodbye GPT-4,716.0,0.98,148.0,dylanneve1,OpenAI,https://i.redd.it/syn1a6fnn1ue1.png,/r/OpenAI/comments/1jw3u4z/goodbye_gpt4/,1744306793.0,,Looks like GPT-4 will be sunset on April 30th and removed from ChatGPT. So long friend 🫡,News,i.redd.it,GPT-4
"Yann LeCun confidently predicted that LLMs will never be able to do basic spatial reasoning. 1 year later, GPT-4 proved him wrong.",636.0,0.8,397.0,dlaltom,OpenAI,https://v.redd.it/ab3qxm7cwy3d1,/r/OpenAI/comments/1d5ns1z/yann_lecun_confidently_predicted_that_llms_will/,1717250886.0,,,Video,v.redd.it,GPT-4
GPT-4.5's Low Hallucination Rate is a Game-Changer – Why No One is Talking About This!,524.0,0.84,213.0,Rare-Site,OpenAI,https://i.redd.it/ww66nsctuqle1.jpeg,/r/OpenAI/comments/1izq37r/gpt45s_low_hallucination_rate_is_a_gamechanger/,1740689338.0,,,Discussion,i.redd.it,GPT-4
